bred_for,breed_group,country_code,country_codes,description,history,id,image_url,imperial_height,imperial_weight,life_span,metric_height,metric_weight,name,origin,perfect_for,species_id,temperament
,Sporting,GB,GB,"Elegant and athletic gundog distinguished by its unique speckled (belton) coat, feathered markings, and graceful movement, known for gentle hunting instincts and friendly disposition","Developed in England over 400 years ago from spaniel stock, refined in the 19th century by Edward Laverack and R. Purcell Llewellin to create a specialized bird dog for locating and setting game birds",101,https://cdn4.thedogapi.com/optimized/DaCvmFBDVI.jpg,Male: 25-27; Female: 23-25,Male: 65-80; Female: 45-70,12-14,Male: 64-69; Female: 58-64,Male: 29-36; Female: 20-32,English Setter,England,,2,"Friendly, gentle, affectionate, intelligent, energetic"
,Herding,US,US,"Exceptionally intelligent and versatile medium-sized herding dog with a dense double coat and strong work ethic, developed as an all-purpose farm dog with devotion to family and adaptable temperament","Developed in the United States from British and Scottish collie-type farm dogs brought by early settlers, bred as versatile all-purpose farm dogs for herding livestock, guarding property, and hunting vermin",102,https://cdn4.thedogapi.com/optimized/cb5ROjCCNf.jpg,Male: 19-23; Female: 18-22,Male: 45-60; Female: 35-50,12-15,Male: 48-58; Female: 46-56,Male: 20-27; Female: 16-23,English Shepherd,United States,,2,"Intelligent, loyal, energetic, alert, devoted, adaptable"
,Sporting,GB,GB,"Medium-sized athletic sporting dog with long ears, feathered silky coat, and enthusiastic, eager-to-please personality. Known for their compact body, gentle intelligent expression, and versatile gundog abilities.","Developed in 19th century England as a versatile gundog to find and 'spring' game for the net, falcon, or gun. Originally separated from smaller 'cocker' spaniels by size and hunting use. Officially recognized by The Kennel Club in 1902 and AKC in 1910.",103,https://cdn4.thedogapi.com/optimized/AT2BZ19dCG.jpg,Male: 19-21; Female: 18-20,Male: 45-55; Female: 35-50,12-14,Male: 48-53; Female: 46-51,Male: 20-25; Female: 16-23,English Springer Spaniel,England,,2,"Friendly, intelligent, energetic, eager to please, playful"
,Toy,GB,GB,"Small, elegant black and tan terrier with fine-boned build and distinctive pointed, candle-flame ears","Descended from the Old English Black and Tan Terrier, bred as a ratter in Victorian England and now a rare companion breed. Recognized by The Kennel Club (UK).",105,https://cdn4.thedogapi.com/optimized/gS4U8SIVh6.jpg,10-12,6-8,12-13,25-30,2.7-3.6,English Toy Terrier (Black & Tan),England,,2,"Alert, intelligent, loyal, playful"
,Non-Sporting,DE,DE,"Medium-sized Spitz-type dog with balanced proportions and thick, plush double coat that comes in a variety of colors. Known for its calm, devoted nature and confident temperament.","Developed in Germany in the 1960s by Julius Wipfel by crossing Chow Chow, Wolfspitz (Keeshond), and Samoyed to create an ideal Spitz-type family companion dog. Recognized by the FCI.",107,https://cdn4.thedogapi.com/optimized/hZkMlKOLPl.jpg,Male: 20.5-23.5; Female: 19-22,Male: 51-71; Female: 40-57,12-14,Male: 52-60; Female: 48-56,Male: 23-32; Female: 18-26,Eurasier,Germany,,2,"Calm, confident, loyal, intelligent, gentle, reserved"
,Sporting,GB,GB,"Medium-sized sporting dog with silky, glossy coat in black, liver, or roan colors, built for endurance and agility in the field with an adaptable, noble temperament","Developed in England during the late 19th century from Cocker Spaniels and other spaniel varieties, initially for show but later redeveloped for field work. The breed faced near extinction after World War II but was revived by dedicated breeders.",108,https://cdn4.thedogapi.com/optimized/Be3GbWbcKe.jpg,17-18,35-50,12-13,43-46,16-23,Field Spaniel,England,,2,"Docile, intelligent, affectionate, gentle, sensitive"
,Herding,FI,FI,"Medium-sized, sturdy spitz-type dog with a thick profuse double coat and fox-like features, originally bred for herding reindeer in arctic conditions by the Sami people","Ancient spitz breed developed by the indigenous Sami people of Lapland to herd and guard reindeer in Arctic conditions. Nearly extinct after WWII but successfully restored by dedicated Finnish breeders, officially recognized by Finnish Kennel Club in 1945",110,https://cdn4.thedogapi.com/optimized/iYYvYN0MXl.jpg,Male: 18-21; Female: 16-19,33-53,12-15,Male: 46-53; Female: 41-49,15-24,Finnish Lapphund,Lapland (Finland),,2,"Friendly, alert, intelligent, calm, courageous, loyal, adaptable"
,Non-Sporting,FI,FI,"Medium-sized fox-like spitz hunting dog with dense golden-red double coat, erect ears, curled plumed tail, and alert expression. Known as Finland's national dog and called the 'barking pointer' for their distinctive hunting style.","Ancient Finnish breed developed through centuries of selective breeding to hunt all types of game from squirrels to bears. Nearly extinct in late 1800s before restoration efforts. Became Finland's national dog in 1979, bred specifically for barking ability and stamina in harsh climates.",111,https://cdn4.thedogapi.com/optimized/0nn8e8rJH2.jpg,Male: 17.5-20; Female: 15.5-18,Male: 25-33; Female: 20-28,12-15,Male: 44.5-51; Female: 39-46,Male: 11-15; Female: 9-13,Finnish Spitz,Finland,,2,"Friendly, alert, intelligent, independent, playful, courageous"
,Non-Sporting,FR,FR,"Small, compact muscular companion dog known for its distinctive large bat-like ears, flat smooshed face, and short smooth coat. Originally developed as a beloved companion breed with a playful, alert disposition.",Developed in 19th century France when English lacemakers brought Toy Bulldogs to France and crossed them with local French ratters becoming highly fashionable in Parisian society,113,https://cdn4.thedogapi.com/optimized/Rvl1BeqaRB.jpg,11-13,16-28,10-12,28-33,7-13,French Bulldog,France,,2,"Affectionate, playful, alert, adaptable, smart"
,Working,DE,DE,"Medium-sized, well-muscled working dog with elegant, athletic build and smooth coat. Known for its high-spirited, alert, and confident demeanor, this is one of Germany's oldest breeds.","Ancient German breed developed for vermin control, ratting, and farm work. Ancestor to the Doberman Pinscher and Miniature Pinscher. Nearly faced extinction after World War II but was revived by Werner Jung in West Germany in the late 1950s. Recognized by AKC in 2003.",114,https://cdn4.thedogapi.com/optimized/j1G4ppvAsp.jpg,17-20,25-45,12-14,43-51,11-20,German Pinscher,Germany,,2,"Alert, courageous, intelligent, energetic, confident, loyal"
,Herding,DE,DE,"Large, athletic working dog with erect ears, noble expression, and confident bearing. Known for high intelligence, loyalty, courage, and versatility in herding and working roles.","Developed in 1899 by Captain Max von Stephanitz to create the ideal herding dog, standardized from local shepherd dogs. Intelligence and trainability led to worldwide use in police and military roles.",115,https://cdn4.thedogapi.com/optimized/kc6oAx2b3X.jpg,Male: 24-26; Female: 22-24,Male: 65-90; Female: 50-70,9-13,Male: 61-66; Female: 56-61,Male: 29-41; Female: 23-32,German Shepherd,Germany,,2,"Confident, courageous, intelligent, loyal, protective"
,Sporting,DE,DE,"A versatile, athletic, and noble all-purpose hunting dog with a distinctive short, dense liver and white coat, known for its intelligence, energy, and friendly disposition","Developed in 19th-century Germany by crossing Spanish Pointers, Bloodhound, and local German hunting dogs to create a versatile pointer-retriever capable of working on land and water. Recognized by AKC in 1930.",116,https://cdn4.thedogapi.com/optimized/A7aYZ5fINU.jpg,Male: 23-25; Female: 21-23,Male: 55-70; Female: 45-60,10-12,Male: 58-64; Female: 53-58,Male: 25-32; Female: 20-27,German Shorthaired Pointer,Germany,,2,"Friendly, intelligent, energetic, eager to please, athletic"
,Working,DE,DE,"Large, powerful, and robust working dog with a dense wiry, weather-resistant coat, distinctive beard and eyebrows, and commanding, imposing presence. Originally bred for driving cattle and guarding in Germany.","Developed in Bavaria and Württemberg, Germany as a larger version of the Standard Schnauzer by crossing with larger breeds like the Great Dane. Originally used for driving cattle to market, guarding property, breweries and farms, and later as police and military working dogs.",119,https://cdn4.thedogapi.com/optimized/Ygv4UKHpCW.jpg,Male: 25.5-27.5; Female: 23.5-25.5,Male: 60-85; Female: 55-75,12-15,Male: 65-70; Female: 60-65,Male: 27-39; Female: 25-34,Giant Schnauzer,Germany,,2,"Loyal, intelligent, alert, energetic, courageous, confident"
,Terrier,IE,IE,"A strong, low-set working terrier of medium length with a sturdy, powerful build. Known for its harsh, weather-resistant double coat and courageous working temperament developed in the rugged Irish mountains.","Originated in the rugged Glen of Imaal valley as an all-around farm dog for hunting badgers and foxes, eradicating vermin, and historically used as turnspit dogs. Recognized by Irish Kennel Club in 1934 and AKC in 2004.",120,https://cdn4.thedogapi.com/optimized/lzq3JY4LXN.jpg,12.5-14,Male: 32-40; Female: 30-40,10-15,32-36,Male: 15-18; Female: 14-18,Glen of Imaal Terrier,"Glen of Imaal, County Wicklow, Ireland",,2,"Courageous, gentle, loyal, intelligent, spirited"
,Sporting,GB,GB,"Large, athletic sporting dog with a dense, lustrous, flowing golden coat and friendly disposition, known for their versatility as family companions and working dogs","Developed in the Scottish Highlands during the mid-to-late 19th century by Dudley Marjoribanks (Lord Tweedmouth), who crossed a yellow retriever with the now-extinct Tweed Water Spaniel, with later additions of Irish Setter and Bloodhound for hunting and retrieving in rugged terrain and cold water",121,https://cdn4.thedogapi.com/optimized/X9w40D9ojT.jpg,Male: 23-24; Female: 21.5-22.5,Male: 65-75; Female: 55-65,10-12,Male: 58-61; Female: 55-57,Male: 29-34; Female: 25-29,Golden Retriever,Scotland,,2,"Friendly, intelligent, devoted, confident, loyal, eager to please"
,Sporting,GB,GB,"Large, athletic bird dog with distinctive glistening black-and-tan coat. Built sturdily for work in rugged terrain, it is the heaviest and most substantial of the setter breeds, known for endurance and loyalty with an alert expression.",Developed in Scotland by Alexander the fourth Duke of Gordon in the late 18th and early 19th centuries from black and tan setters. Established as a durable one-man bird dog capable of working long days in rugged Scottish Highland terrain.,123,https://cdn4.thedogapi.com/optimized/GFuEqzH0Fq.jpg,Male: 24-27; Female: 23-26,Male: 55-80; Female: 45-70,12-13,Male: 61-69; Female: 58-66,Male: 25-36; Female: 20-32,Gordon Setter,Scotland,,2,"Confident, loyal, affectionate, intelligent, eager to please, alert"
,Working,DE,DE,"Giant, regal breed known as the 'Apollo of Dogs' with a powerful, well-muscled body, sleek coat, and dignified presence combined with noble bearing despite imposing size","Originally bred by German nobility from Mastiff-type dogs to hunt wild boar and deer, later refined as estate guardians and companions. Declared national dog of Germany in 1876 and standardized as 'Deutsche Dogge'",124,https://cdn4.thedogapi.com/optimized/MmjpsRG5IG.jpg,Male: 30-32; Female: 28-30,Male: 140-175; Female: 110-140,7-10,Male: 76-81; Female: 71-76,Male: 64-79; Female: 50-64,Great Dane,Germany,,2,"Friendly, gentle, confident, loyal, affectionate"
,Hound,GB,GB,"An ancient sighthound with tall, lean, elegant build designed for exceptional speed. Known for their gentle temperament and often described as a '45-mph couch potato', combining incredible athleticism with calm, affectionate nature.","Ancient sighthound breed dating back thousands of years, depicted in Egyptian, Greek, and Roman art. The modern Greyhound was standardized in Great Britain for coursing game and later racing. Famed as the fastest dog breed.",127,https://cdn4.thedogapi.com/optimized/fVVxWR2qse.jpg,Male: 28-30; Female: 27-28,Male: 65-70; Female: 60-65,10-13,Male: 71-76; Female: 68-71,Male: 29-32; Female: 27-29,Greyhound,Ancient Egypt/Middle East,,2,"Gentle, calm, intelligent, affectionate, independent"
,Hound,GB,GB,"Medium-sized athletic scent hound bred for pack hunting hare, resembling a smaller English Foxhound with sturdy build, short dense coat, and excellent stamina","Developed in medieval England for hare hunting in packs, documented since at least the 13th century. Likely descended from English Foxhound, Talbot Hounds, and other French hounds",129,https://cdn4.thedogapi.com/optimized/6H9mhrLwdk.jpg,19-21,45-60,12-15,48-53,20-27,Harrier,England,,2,"Friendly, outgoing, energetic, intelligent, gentle"
,Toy,CU,CU,"Small, sturdy companion dog with long, silky double coat and cheerful temperament. Cuba's national dog, known for its intelligent disposition and making an ideal city companion.","Developed from Bichon-type ancestors brought by Spanish settlers, became companions to Cuban aristocracy. Nearly extinct after Cuban Revolution but preserved by Cuban families who fled to the United States.",130,https://cdn4.thedogapi.com/optimized/8bzLyVs2dA.jpg,8.5-11.5,7-13,,22-29,3-6,Havanese,Cuba,,2,"Outgoing, intelligent, friendly, playful, affectionate, adaptable"
,Sporting,IE,IE,"Elegant, athletic gundog known for its stunning mahogany or rich chestnut red flowing coat and high-energy, friendly temperament","Developed in 18th-century Ireland as a versatile gundog for setting and retrieving game birds by crossing Irish Water Spaniel, English Setter, and Pointer. The breed's striking mahogany color became a hallmark in the 19th century, distinguishing it from earlier red-and-white setters",134,https://cdn4.thedogapi.com/optimized/wWecmugBdH.jpg,Male: 26-29; Female: 24-27,Male: 60-75; Female: 53-65,12-15,Male: 66-74; Female: 61-69,Male: 27-34; Female: 24-29,Irish Setter,Ireland,,2,"Friendly, outgoing, energetic, intelligent, playful, affectionate"
,Terrier,IE,IE,"Medium-sized terrier with a distinctive wiry, fiery red coat and bold, spirited temperament. Known for its courage and loyalty, it is one of the oldest terrier breeds.","One of the oldest terrier breeds, developed in County Cork, Ireland as all-purpose farm dogs for hunting vermin and guarding homes. Their courage was proven in World War I where they served as messenger dogs and sentinels.",135,https://cdn4.thedogapi.com/optimized/pVmDXiYLCl.jpg,Male: 18-19; Female: 17-19,Male: 25-28; Female: 24-27,,Male: 46-48; Female: 43-48,Male: 11-13; Female: 11-12,Irish Terrier,Ireland,,2,"Courageous, loyal, intelligent, energetic, spirited"
,Hound,IE,IE,"A giant-sized sighthound of imposing appearance and dignified nature, the Irish Wolfhound is the tallest of all dog breeds. Known for its wiry, rough coat and gentle giant temperament, this ancient breed combines courage with a calm, dignified demeanor.",Ancient breed from Ireland originally used in war and for hunting wolves and Irish elk. Nearly extinct by the 1860s but revived by Captain George Augustus Graham who standardized the breed.,137,https://cdn4.thedogapi.com/optimized/s2EMPFktdk.jpg,Male: 32-35; Female: 30-33,Male: 140-180; Female: 115-140,6-8,Male: 81-89; Female: 76-84,Male: 64-82; Female: 52-64,Irish Wolfhound,Ireland,,2,"Gentle, calm, dignified, courageous, loyal"
,Toy,IT,IT,"Elegant small sighthound with slender, delicate build and graceful movement, combining the look of a large hound with the size of a lap dog and fine, smooth coat","Ancient breed with origins tracing back over 2,000 years to the Mediterranean basin, favored by nobility in ancient Greece, Rome, and Italian Renaissance, AKC recognized since 1886",138,https://cdn4.thedogapi.com/optimized/dn8F4NPRdX.jpg,13-15,7-14,,33-38,3-6.5,Italian Greyhound,Italy,,2,"Affectionate, gentle, playful, alert, intelligent"
,Toy,JP,JP,"Small, elegant toy breed with distinctive flat face, large wide-set eyes, and luxurious silky coat. Known for their aristocratic bearing and unique cat-like demeanor, often cleaning their faces and perching in high places.","Ancient breed believed to have originated in the Chinese imperial court, then refined in Japan by nobility as cherished lap dogs and companions. Often given as gifts to diplomats and royalty, including to Commodore Matthew Perry who brought them to the West in 1853.",140,https://cdn4.thedogapi.com/optimized/1TlHrdv5SQ.jpg,8-11,4-11,10-12,20-28,1.8-5,Japanese Chin,China/Japan,,2,"Alert, intelligent, affectionate, independent, playful, calm"
,Non-Sporting,JP,JP,"Small to medium-sized spitz-type dog with profuse, pure-white double coat, fox-like face with pointed muzzle, and plumed tail carried over its back. This lively companion dog has an alert, friendly disposition.","Developed in Japan in the 1920s-1930s from various spitz breeds including large white German Spitz dogs brought to Japan around 1920. The breed was developed through selective breeding for friendly temperament and white coat, first exhibited in Tokyo in 1921. After World War II, the breed standard was unified by the Japan Kennel Club.",141,https://cdn4.thedogapi.com/optimized/a9bVhDxsQC.jpg,12-15.5,Male: 11-25; Female: 10-20,12-16,30-39,Male: 5-11; Female: 4.5-9,Japanese Spitz,Japan,,2,"Intelligent, playful, alert, loyal, affectionate, friendly"
,Working,TR,TR,"Large, powerful, and heavy-boned livestock guardian dog with distinctive fawn coat, black mask and ears, and curled tail, bred for protecting flocks from predators","Ancient livestock guardian breed originating from the Kangal district in the Sivas province of Turkey. For centuries used by shepherds to protect flocks from wolves, bears, and jackals. Considered a national treasure in Turkey and valued for strength, loyalty, and independence.",18,https://cdn4.thedogapi.com/optimized/sQrQ6sVszv.jpg,Male: 30-32; Female: 28-30,Male: 110-145; Female: 90-120,12-15,Male: 76-81; Female: 71-76,Male: 50-66; Female: 41-54,Kangal Shepherd Dog,"Sivas, Turkey",,2,"Loyal, protective, independent, calm, intelligent, alert"
,Non-Sporting,NL,NL,"Medium-sized compact spitz with plush silver-gray double coat, fox-like face, distinctive spectacles markings around the eyes, and plumed tail curled over back","Ancient Dutch breed known as the Dutch Barge Dog, popular companion and watchdog on barges and riverboats along the Rhine River. Became symbol of Dutch Patriots Party in 18th century, nearly extinct after WWII but restored from dogs exported to England and America",142,https://cdn4.thedogapi.com/optimized/ZpfPWRzZjj.jpg,Male: 17-19; Female: 16-18,35-45,12-15,Male: 43-48; Female: 41-46,16-20,Keeshond,Netherlands,,2,"Friendly, intelligent, outgoing, alert, eager to please"
,Toy,GB,GB,"Small, compact toy spaniel with distinctive domed head, flat face, short nose, large dark eyes, long ears, and silky coat available in four color varieties (Blenheim, Tricolour, Ruby, and Black and Tan). Known as the English Toy Spaniel in the USA.","Descended from toy spaniels popular with European nobility since the 16th century, famously associated with King Charles II who favored companion spaniels. Modern flat-faced appearance developed through crossings with short-nosed Asian toy breeds in the 18th-19th centuries. The four color varieties were once considered separate breeds.",104,https://cdn4.thedogapi.com/optimized/MT3wm2MmFG.jpg,9-11,8-14,10-12,23-28,3.6-6.3,King Charles Spaniel,England,,2,"Gentle, affectionate, intelligent, friendly, happy, playful"
,Working,HU,HU,"Large, muscular Hungarian livestock guardian dog with distinctive heavy coat of white cords resembling a mop. Built for endurance and protection, this imposing breed possesses a dignified, courageous demeanor.",Ancient breed descended from Tibetan dogs brought to Hungary by nomadic Magyar tribes over a thousand years ago around 1000 AD. Developed to be formidable independent livestock guardian protecting sheep and cattle from wolves bears and harsh weather.,144,https://cdn4.thedogapi.com/optimized/vutXumi0ih.jpg,Male: 27.5-31.5; Female: 25.5-27.5,Male: 100-130; Female: 80-110,10-12,Male: 70-80; Female: 65-70,Male: 45-59; Female: 36-50,Komondor,Hungary,,2,"Loyal, protective, independent, courageous, calm"
,Sporting,NL,NL,"Small, agile spaniel-type dog of Dutch origin with a distinctive flowing orange-red and white particolored coat and feathered ears, originally bred for luring ducks into traps","Ancient Dutch breed developed as early as the 16th century to work as duck decoy dogs, luring ducks into traps called 'eendenkooien'. Nearly extinct after World War II but saved and re-established by Baroness van Hardenbroek van Ammerstol from remaining bloodlines. Recognized by AKC in 2018.",145,https://cdn4.thedogapi.com/optimized/hrBH92kypI.jpg,Male: 15-17; Female: 14-16,20-30,12-15,Male: 38-43; Female: 36-41,9-14,Kooikerhondje,Netherlands,,2,"Friendly, intelligent, alert, energetic, cheerful, adaptable"
,Working,HU,HU,"Large, powerful white Hungarian livestock guardian dog with a dense double coat, noble bearing, and fiercely loyal, protective nature","Ancient Hungarian breed descended from large molosser-type dogs from Tibet. Historically served as royal guard dogs for Magyar kings and fierce livestock guardians, prized for their loyalty and courage in protecting flocks and estates from predators and thieves",147,https://cdn4.thedogapi.com/optimized/TpZNIKNjnH.jpg,Male: 28-30; Female: 26-28,Male: 100-115; Female: 70-90,10-12,Male: 71-76; Female: 66-71,Male: 45-52; Female: 32-41,Kuvasz,Hungary,,2,"Loyal, protective, independent, courageous, intelligent, calm"
,Sporting,CA,CA,"Medium to large, strong athletic retriever with short dense coat and friendly outgoing temperament. Consistently one of the most popular breeds worldwide.",Originated from St. John's Water Dogs used by fishermen in Newfoundland for retrieving nets and escaped fish. Further developed and standardized in England during the 1800s by English nobles for waterfowl retrieving,149,https://cdn4.thedogapi.com/optimized/BE5AcsNMdm.jpg,Male: 22.5-24.5; Female: 21.5-23.5,Male: 65-80; Female: 55-70,10-12,Male: 57-62; Female: 55-60,Male: 29-36; Female: 25-32,Labrador Retriever,"Newfoundland, Canada",,2,"Friendly, outgoing, energetic, intelligent, gentle, eager to please"
,Sporting,IT,IT,"Medium-sized rustic water retriever with dense, curly, waterproof coat and exceptional sense of smell, specialized as the world's premier truffle-hunting dog","Ancient breed from the Romagna region of Italy, originally used as a water retriever in the marshlands. When the marshes were drained, the breed was adapted and became the world's premier truffle-hunting dog.",151,https://cdn4.thedogapi.com/optimized/YwlHg9x5AL.jpg,Male: 17-19; Female: 16-18,Male: 28.5-35; Female: 24-31,,Male: 43-48; Female: 41-46,Male: 13-16; Female: 11-14,Lagotto Romagnolo,"Romagna region, Italy",,2,"Affectionate, intelligent, energetic, loyal, alert, work-focused"
,Herding,GB,GB,"Small, sturdy herding dog with short legs and a low-set build. Features a short black and tan weatherproof double coat and distinctive foxlike expression with alert nature.","Developed in Lancashire, England as an all-purpose farm dog for herding cattle by nipping at heels and for ratting. Believed to be developed from crosses between Welsh Corgis and Manchester Terriers. Nearly extinct by the 1960s but saved through dedicated breeding programs. Recognized by The Kennel Club (UK) in 1981 and AKC in 2024.",153,https://cdn4.thedogapi.com/optimized/4yAqsHVUjE.jpg,10-12,9-17,12-15,25-30,4-8,Lancashire Heeler,"Lancashire, England",,2,"Intelligent, alert, energetic, friendly, playful, courageous"
,Working,DE,DE,"Giant, majestic working dog with a lion-like appearance, thick water-resistant double coat, and gentle, balanced temperament. This powerful yet serene breed combines an imposing presence with a calm, patient demeanor.","Developed in the 1840s by Heinrich Essig in Leonberg, Germany, crossing Newfoundlands, Saint Bernards, and Pyrenean Mountain Dogs to create a 'lion-like' dog resembling the lion on the town crest. Became popular companion for European royalty",155,https://cdn4.thedogapi.com/optimized/EtmEHVP7o1.jpg,Male: 28-31.5; Female: 25.5-29.5,Male: 110-170; Female: 90-140,7-9,Male: 71-80; Female: 65-75,Male: 50-77; Female: 41-64,Leonberger,"Leonberg, Germany",,2,"Gentle, calm, loyal, friendly, intelligent, confident"
,Non-Sporting,CN,CN,"Small, hardy, and sturdy ancient Tibetan breed known for its floor-length coat of hair that parts down the back and alert, confident expression, originally bred as palace and monastery sentinel","Ancient breed developed in Tibetan monasteries and palaces over a thousand years ago as indoor sentinel dogs, alerting monks to intruders. Highly prized and rarely left the country until brought to England in 1920s",156,https://cdn4.thedogapi.com/optimized/QTZrK5N6RA.jpg,Male: 10-11; Female: 9-11,Male: 12-18; Female: 11-18,12-15,Male: 25-28; Female: 23-28,Male: 5.4-8.2; Female: 5.0-8.2,Lhasa Apso,Tibet,,2,"Confident, independent, alert, loyal, smart, protective"
,Toy,MT,MT,"An ancient toy breed from the Mediterranean with a long, silky white coat and charming, playful personality combined with a fearless nature despite their diminutive size","One of the world's oldest known breeds dating back over 2000 years, originating from the island of Malta. Historically known as 'Ye Ancient Dogge of Malta' and prized as companions to royalty and aristocracy throughout Mediterranean civilizations and European nobility",161,https://cdn4.thedogapi.com/optimized/6Kzt53hxrg.jpg,7-9,4-7,12-15,18-23,1.8-3.2,Maltese,"Malta, Mediterranean Basin",,2,"Playful, gentle, affectionate, charming, fearless, alert, adaptable"
