bred_for,breed_group,country_code,country_codes,description,history,id,image_url,imperial_height,imperial_weight,life_span,metric_height,metric_weight,name,origin,perfect_for,species_id,temperament
,Herding,US,US,"Small, athletic herding dog with a striking double coat and keen intelligence, essentially a compact version of the Australian Shepherd with intense work drive and devotion","Developed in California during the late 1960s from small Australian Shepherds, bred for compact size while maintaining herding ability. Became popular with equestrians traveling to horse shows and was recognized by the AKC Herding Group in 2015.",165,https://cdn4.thedogapi.com/optimized/azYjQgJT4i.jpg,Male: 14-18; Female: 13-17,20-40,12-13,Male: 36-46; Female: 33-43,9-18,Miniature American Shepherd,United States,,2,"Intelligent, energetic, devoted, loyal, eager to please, work-focused"
,Toy,DE,DE,"Small, compact, and elegant toy breed with a distinctive high-stepping 'hackney' gait and spirited personality. Despite resembling a miniature Doberman, this is an older, distinct German breed with a proud carriage and 'big dog' attitude in a small package.","An old German breed (Zwergpinscher) developed centuries ago to hunt rats in homes and stables. Not a miniaturized Doberman Pinscher, but a distinct older breed likely descended from German Pinschers with contributions from Italian Greyhounds and Dachshunds.",167,https://cdn4.thedogapi.com/optimized/eEr2arSRx8.jpg,10-12.5,8-10,12-16,25-32,3.5-4.5,Miniature Pinscher,Germany,,2,"Energetic, alert, confident, intelligent, courageous, fearless"
,Terrier,DE,DE,"Small, sturdy terrier-type dog with distinctive wiry coat, bushy eyebrows, and characteristic beard, known for its alert, friendly nature and square build",Developed in late 19th century Germany by crossing Standard Schnauzers with smaller breeds like Affenpinschers and Poodles to create an all-purpose farm dog and efficient ratter for vermin control and companionship,168,https://cdn4.thedogapi.com/optimized/28pSRwqLJd.jpg,Male: 12-14; Female: 11-14,Male: 11-20; Female: 10-20,12-15,Male: 30-36; Female: 28-36,5-9,Miniature Schnauzer,Germany,,2,"Friendly, intelligent, alert, outgoing, energetic"
,Working,CA,CA,"Massive, powerful working dog known for exceptional water rescue abilities and gentle temperament. Often called the 'gentle giant,' this breed features a thick, water-resistant double coat, webbed feet, and natural swimming ability.","Developed by fishermen on the island of Newfoundland for water rescue, hauling nets, and cart pulling. Descended from indigenous water dogs and European breeds brought by fishermen, recognized by major kennel clubs in the 19th century.",171,https://cdn4.thedogapi.com/optimized/XoNRi6HPSY.jpg,Male: 28-30; Female: 26-28,Male: 130-150; Female: 100-120,9-10,Male: 71-76; Female: 66-71,Male: 59-68; Female: 45-54,Newfoundland,"Newfoundland, Canada",,2,"Gentle, loyal, devoted, calm, intelligent"
,Terrier,GB,GB,"Small, sturdy, and fearless terrier with a wiry, weather-resistant coat and characteristic drop ears. Known for its spirited, affectionate nature and bred for ratting and companionship.","Developed in Norfolk and East Anglia, England in the 1880s-early 20th century as farm dogs to control vermin and hunt foxes. Originally classified as the drop-eared variety of the Norwich Terrier, separated as distinct breed in 1964 by The Kennel Club (UK) and 1979 by the AKC based on ear carriage.",172,https://cdn4.thedogapi.com/optimized/aQ4ySqmNa3.jpg,9-10,11-12,12-16,23-25,5-5.5,Norfolk Terrier,"Norfolk, England",,2,"Alert, courageous, affectionate, energetic, playful"
,Terrier,GB,GB,"Small, sturdy, and compact terrier with distinctive prick ears, wiry double coat, and lively disposition. Known for its hardy constitution and fearless but affectionate nature.","Developed in East Anglia, England in the 1880s as a rugged earth-dog for ratting and fox bolting. Originally grouped with Norfolk Terrier until official separation in 1964 based on ear carriage (Norwich has prick ears). Recognized by AKC in 1979.",176,https://cdn4.thedogapi.com/optimized/D9NaMDkqnJ.jpg,9-10,11-12,12-15,23-25,5-5.5,Norwich Terrier,"East Anglia, England",,2,"Alert, energetic, affectionate, courageous, outgoing"
,Sporting,CA,CA,"The smallest of the retrievers, this medium-sized, athletic sporting dog is known for its distinctive reddish coat with white markings and enthusiastic personality. Originally bred for luring and retrieving waterfowl by playing along the shoreline.","Developed in early 19th century Nova Scotia, specifically in the Little River Harbour area of Yarmouth County, to 'toll' (lure) ducks within gunshot range by playing along the shoreline, then retrieve shot birds. Recognized by AKC in 2003.",177,https://cdn4.thedogapi.com/optimized/hCcdtR8rVg.jpg,Male: 18-21; Female: 17-20,35-50,12-14,Male: 46-53; Female: 43-51,16-23,Nova Scotia Duck Tolling Retriever,"Nova Scotia, Canada",,2,"Intelligent, energetic, playful, outgoing, alert, affectionate"
,Foundation Stock Service,US,US,"Athletic and muscular, medium-sized bulldog breed developed to recreate the healthier, more athletic Regency-era English Bulldog with improved health, stable temperament, and well-balanced features without exaggeration","Developed in the 1970s by David Leavitt to recreate the healthier, more athletic bulldog of the 18th and 19th centuries (Regency Period) using crosses of English Bulldog, American Bulldog, American Pit Bull Terrier, and Bullmastiff. Recognized by UKC but not AKC",179,https://cdn4.thedogapi.com/optimized/NUF657Zjvh.jpg,Male: 17-20; Female: 16-19,Male: 60-80; Female: 50-70,9-14,Male: 43-51; Female: 41-48,Male: 27-36; Female: 23-32,Olde English Bulldogge,United States,,2,"Confident, courageous, alert, friendly, loyal"
,Herding,GB,GB,"Large, athletic herding dog of great strength with distinctive profuse, shaggy double coat in gray and white, famous for its peek-a-boo hairdo and characteristic bear-like gait",Developed in western England in the late 18th century likely from breeds like Bearded Collie and Russian Owtchar. Bred as drovers' dogs to drive cattle and sheep to market. Tails were historically docked to identify them as working dogs exempting them from taxes. Recognized by AKC in 1888,178,https://cdn4.thedogapi.com/optimized/XVygKfbKvg.jpg,Male: 22-24; Female: 21-22,Male: 70-100; Female: 60-85,10-12,Male: 56-61; Female: 53-56,Male: 32-45; Female: 27-39,Old English Sheepdog,England,,2,"Intelligent, gentle, playful, adaptable, affectionate"
,Toy,FR,FR,"Small, fine-boned, and elegant toy spaniel with distinctive butterfly-like ears (papillon is French for 'butterfly') and silky flowing coat, known for their alert, friendly, and energetic nature","Descended from continental toy spaniels that were popular in European courts for centuries, appearing in paintings by masters like Titian, Goya, and Rubens. The breed was refined in France and Belgium, with the original drop-eared variety (Phalène) later joined by the erect-eared 'butterfly' version (Papillon)",181,https://cdn4.thedogapi.com/optimized/0qgmSrCbvZ.jpg,8-11,5-10,,20-28,2-4.5,Papillon,France and Belgium,,2,"Friendly, intelligent, alert, energetic, happy"
,Toy,CN,CN,"Small, compact toy dog of Chinese nobility with a long, profuse double coat, distinctive flat-faced expression, rolling gait, and regal bearing originally bred for Chinese royalty",Ancient breed developed in Chinese imperial court and held sacred in the Imperial Palace in Peking (now Beijing). Exclusively owned by royalty for over 1000 years until Western dogs were brought to England after British troops entered the Forbidden City in 1860 during the Opium Wars.,183,https://cdn4.thedogapi.com/optimized/QpW51pxyRk.jpg,6-9,7-14,12-14,15-23,3.2-6.4,Pekingese,China,,2,"Loyal, independent, confident, courageous, affectionate, alert"
,Herding,GB,GB,"A low-set, strong, and sturdily built herding dog with short legs, fox-like face, alert expression, and naturally bobbed tail. Known for their intelligence, sturdy build, and distinctive appearance.","Ancient herding breed from Pembrokeshire, Wales, brought by Flemish weavers in 1107. Developed as a cattle herding dog, their low stature allowed them to nip at cattle's heels and avoid being kicked. Closely associated with British royalty.",184,https://cdn4.thedogapi.com/optimized/R33EpeVC4M.jpg,10-12,Male: 27-30; Female: 25-28,12-13,25-30,Male: 12-14; Female: 11-13,Pembroke Welsh Corgi,"Pembrokeshire, Wales",,2,"Intelligent, affectionate, alert, outgoing, playful"
,Hound,MT,MT,"Medium-sized elegant sighthound with short tan coat, alert expression, and distinctive ability to 'blush' on nose and ears when excited. A graceful, powerful, and swift breed of ancient origins.","National dog of Malta and ancient breed believed descended from Egyptian hunting dogs brought by Phoenician traders over 2,000 years ago. Known as 'Kelb tal-Fenek' (rabbit dog) in Malta, used for rabbit hunting. One of oldest domesticated breeds with depictions found in ancient Egyptian tombs. Recognized by AKC in 1983.",188,https://cdn4.thedogapi.com/optimized/dIwJe77wP0.jpg,Male: 23-25; Female: 21-24,45-55,12-14,Male: 58-64; Female: 53-61,20-25,Pharaoh Hound,Malta,,2,"Intelligent, friendly, playful, alert, affectionate"
,Hound,US,US,"Athletic, streamlined, and powerful scent hound with distinctive brindle coat, known for its intelligence, courage, and exceptional tracking ability. Originally bred for big-game hunting including bear and boar.",Developed in the mountains of North Carolina by German immigrant Johannes Georg Plott from German Hanoverian Schweisshunds brought in the 1750s. Perfected over generations for big-game hunting in the Appalachian Mountains. The only coonhound breed not descended from foxhounds and official state dog of North Carolina.,189,https://cdn4.thedogapi.com/optimized/xqSZ5QgaTA.jpg,Male: 20-25; Female: 20-23,Male: 50-60; Female: 40-55,12-14,Male: 51-64; Female: 51-58,Male: 23-27; Female: 18-25,Plott Hound,"North Carolina, United States",,2,"Loyal, alert, courageous, intelligent, devoted"
,Toy,DE,DE,"Small, compact, active toy spitz breed with abundant fluffy double coat, fox-like expression, and plumed tail carried over the back",Descended from larger Arctic spitz-type sled dogs and bred down to current small size in the Pomerania region. Popularity greatly increased by Queen Victoria who became a breeder and established distinct breed standards,193,https://cdn4.thedogapi.com/optimized/zuTzCtrqg3.jpg,6-7,3-7,12-16,15-18,1.4-3.2,Pomeranian,Pomerania region (now parts of Germany and Poland),,2,"Alert, intelligent, playful, confident, outgoing"
,Non-Sporting,DE,DE,"Elegant, athletic, and intelligent smaller version of the Standard Poodle with a curly, hypoallergenic coat and proud carriage","Originally developed as water retrievers in Germany, the name 'Poodle' comes from German 'pudel' meaning 'to splash in water'. Miniature variety was bred down from Standard Poodles for companionship, circus performance, and truffle hunting",196,https://storage.googleapis.com/dog-api-uploads-prod/originals/26157129-e8cc-44a1-bbb1-cec578a5f3d7.png,10-15,10-15,12-16,25-38,4.5-6.8,Poodle (Miniature),Germany,,2,"Intelligent, alert, playful, confident, eager to please"
,Toy,DE,DE,"Smallest Poodle variety with dense curly hypoallergenic coat and alert, intelligent demeanor. An elegant, proud companion dog known for exceptional trainability and performing ability.",Despite association with France the Poodle originated in Germany as water retrieving dog from German pudel meaning to splash in water. The Toy variety was bred down from Standard and Miniature Poodles for urban companionship and prized by aristocracy for intelligence and performing ability. AKC recognition 1887.,197,https://storage.googleapis.com/dog-api-uploads-prod/originals/be1783c6-87c7-49bb-80b4-781e91374766.png,8-10,4-6,10-18,20-25,1.8-2.7,Poodle (Toy),Germany,,2,"Intelligent, alert, confident, playful, affectionate, loyal, outgoing"
,Working,ES,ES,"Large, powerfully built mastiff-type dog with robust frame, calm attentive expression, and imposing presence as a confident guardian","Ancient breed native to the Canary Islands, originally developed as versatile farm and guard dog for guarding livestock and property, used for catching and holding cattle. Nearly extinct by the 1960s but revived through careful breeding programs in the 1970s",185,https://cdn4.thedogapi.com/optimized/nF8GskKeDc.jpg,Male: 23-26; Female: 22-25,Male: 110-130; Female: 85-110,9-11,Male: 58-66; Female: 56-64,Male: 50-59; Female: 39-50,Presa Canario,"Canary Islands, Spain",,2,"Confident, calm, protective, intelligent, loyal, courageous"
,Toy,CN,CN,"Small, compact, and sturdy toy breed with a distinctive wrinkled, short-muzzled face, curled tail, and charming, mischievous personality","Ancient breed originating in China as prized companions for Chinese emperors. Brought to Europe in the 16th century by Dutch traders, became official dog of House of Orange in Holland, gained widespread popularity in Victorian England",201,https://cdn4.thedogapi.com/optimized/sKx0rFHMRN.jpg,10-13,14-18,,25-33,6-8,Pug,China,,2,"Affectionate, playful, friendly, charming, adaptable"
,Herding,HU,HU,"Compact, medium-sized Hungarian herding dog known for its distinctive, naturally corded coat resembling dreadlocks, giving it an agile and athletic build with quick, spirited movement","Ancient Hungarian sheepdog breed brought by Magyar tribes over 1000 years ago, traditionally used for herding and guarding livestock on the Hungarian plains. Their unique corded coat provided protection from predators and harsh weather. Nearly decimated by World War II but saved by dedicated breeding programs",204,https://cdn4.thedogapi.com/optimized/BH8KAhIGvc.jpg,Male: 16.5-17.5; Female: 14.5-16.5,Male: 30-35; Female: 25-30,10-16,Male: 40-44; Female: 37-41,Male: 13.5-16; Female: 11-14,Puli,Hungary,,2,"Intelligent, energetic, loyal, alert, devoted, playful"
,Herding,HU,HU,"Medium-sized, agile Hungarian herding dog known for its whimsical, terrier-like expression, distinctive corkscrew-curled coat, and high-set semi-erect ears with an alert, lively attitude","Developed in Hungary during the 17th-18th centuries from crossbreeding the native Puli with German and French herding dogs and terriers. Used as versatile farm dogs for herding cattle, sheep, and swine",205,https://cdn4.thedogapi.com/optimized/yJmx50juxq.jpg,Male: 16-18.5; Female: 15-17.5,22-29,12-13,Male: 41-47; Female: 38-44,10-13,Pumi,Hungary,,2,"Intelligent, energetic, alert, playful, loyal, confident"
,Working,FR,FR,"Large, majestic, and immensely powerful livestock guardian with thick white double coat and natural guardian instincts developed for mountain work",Ancient breed used for centuries by shepherds in the Pyrenees Mountains of France and Spain to guard flocks against predators like wolves and bears. Known as 'Chien de Montagne des Pyrénées' and standardized by the FCI.,125,https://storage.googleapis.com/dog-api-uploads-prod/originals/1b8f2066-261d-46d4-a358-23f61edc5d1a.png,Male: 27-32; Female: 25-29,Male: 100-160; Female: 85-115,10-12,Male: 69-81; Female: 63-74,Male: 45-73; Female: 39-52,Pyrenean Mountain Dog,"Pyrenees Mountains, France",,2,"Gentle, confident, protective, independent, calm, loyal"
,Terrier,US,US,"Compact, energetic American terrier with smooth coat and athletic build, developed as a versatile all-purpose farm dog and vermin hunter","Developed in early 20th century United States from European terriers brought by British migrants, including Fox Terrier and Manchester Terrier, for farm vermin control and companionship. President Theodore Roosevelt was a notable owner and credited with naming the breed. AKC recognition in 2013.",207,https://cdn4.thedogapi.com/optimized/mR1VeAsbKF.jpg,10-18,10-25,12-18,25-46,4-11,Rat Terrier,United States,,2,"Alert, intelligent, energetic, friendly, playful, loyal"
,Hound,US,US,"Medium to large athletic hound with a striking solid red coat, known for its speed, agility, and powerful scenting ability. Sleek and muscular, this breed was developed specifically for hunting raccoons and other game.","Developed in the American South, primarily in Georgia, during the late 18th and early 19th centuries by Scottish immigrants. Created from red-colored Irish Foxhounds and Bloodhounds to produce a fast, hot-nosed hound for trailing and treeing raccoons and larger game. The breed name is attributed to early breeder Peter Redbone. Recognized by the AKC in 2009.",208,https://cdn4.thedogapi.com/optimized/9kvNw9tFVP.jpg,Male: 22-27; Female: 21-26,45-70,12-15,Male: 56-69; Female: 53-66,20-32,Redbone Coonhound,United States,,2,"Friendly, loyal, eager to please, energetic, affectionate"
,Hound,ZA,ZA,"Large, muscular, and athletic hound with a distinctive ridge of hair running along its back, originally bred to hunt lions in Africa. Known for their dignified, even-tempered nature and loyal disposition.","Developed in Southern Africa by crossing native ridged Khoikhoi dogs with European breeds like Mastiffs and Greyhounds. Bred by farmers and hunters for tracking and holding big game, notably lions, at bay. Recognized by South African Kennel Union in the 1920s.",209,https://cdn4.thedogapi.com/optimized/Q3DE5jQ8fR.jpg,Male: 25-27; Female: 24-26,Male: 80-90; Female: 65-75,10-12,Male: 64-69; Female: 61-66,Male: 36-41; Female: 29-34,Rhodesian Ridgeback,Southern Africa,,2,"Loyal, intelligent, confident, independent, affectionate"
,Working,DE,DE,"Large, robust, muscular working dog with black coat and tan markings, known for great strength, protective instincts, and confident temperament. A loyal and loving guardian breed.","Descended from Roman drover dogs, developed in the German town of Rottweil as cattle herders and guard dogs. Known as the 'Butcher's Dog of Rottweil', they protected butchers' money to and from market. Numbers declined with advent of railroads but was revived in early 20th century. Later used for protection and police work",210,https://cdn4.thedogapi.com/optimized/LxI7Kkc5oH.jpg,Male: 24-27; Female: 22-25,Male: 95-135; Female: 80-100,9-10,Male: 61-69; Female: 56-64,Male: 43-61; Female: 36-45,Rottweiler,"Rottweil, Germany",,2,"Confident, loyal, courageous, calm, protective, affectionate"
,Toy,RU,RU,"Very small, elegant toy breed with fine bone structure and lively expression, available in both smooth and long coat varieties. Known for their cheerful disposition and fragile build.","Developed in Russia from English Toy Terriers in the early 20th century. Nearly extinct after the Russian Revolution but rebuilt from remaining dogs post-WWII, leading to standardization of both smooth and long-coated varieties. Recently recognized by AKC in 2022.",211,https://cdn4.thedogapi.com/optimized/DXnBRzsNdw.jpg,8-11,3-6.5,12-14,20-28,1.4-3,Russian Toy,Russia,,2,"Alert, intelligent, loyal, playful, affectionate, energetic, outgoing"
,Working,CH,CH,"A powerful, giant-sized working breed from the Swiss Alps with distinctive markings and massive head, originally bred for mountain rescue. Known for its gentle, patient nature and calm temperament.",Developed by monks at the Great St. Bernard Hospice on the border of Switzerland and Italy for rescue work in treacherous Alpine conditions. Used to locate and rescue travelers lost in snow and fog of dangerous Alpine passes,212,https://cdn4.thedogapi.com/optimized/IcWEuLHtBn.jpg,Male: 28-30; Female: 26-28,Male: 140-180; Female: 120-140,8-10,Male: 71-76; Female: 66-71,Male: 64-82; Female: 54-64,Saint Bernard,Switzerland,,2,"Gentle, friendly, calm, patient, loyal, protective"
,Hound,EG,EG,"Ancient, elegant sighthound of the Middle East with graceful build, feathered ears and tail, known for extraordinary speed, endurance, and dignified nature. Bred for hunting gazelle across desert terrain.","One of the most ancient domesticated dog breeds, treasured by royalty and Bedouin tribes for thousands of years. Considered sacred by Muslims and revered throughout the Middle East for hunting gazelle and swift prey across desert terrain.",213,https://cdn4.thedogapi.com/optimized/XEsp2dsjPM.jpg,23-28,Male: 40-65; Female: 35-55,10-17,58-71,Male: 18-29; Female: 16-25,Saluki,Middle East (Fertile Crescent),,2,"Gentle, independent, intelligent, devoted, calm, reserved"
,Working,RU,RU,"A powerful and graceful medium to large Arctic spitz breed with a thick, all-white double coat and distinctive 'Samoyed smile' created by the upturned corners of the mouth","Ancient breed developed by the nomadic Samoyede people of Siberia over 3,000 years ago for herding reindeer, pulling sleds, and companionship. Their thick coats protected them from brutal climate, and they often slept with families for warmth. Brought out of Siberia in late 19th and early 20th centuries. Recognized by AKC in 1906.",214,https://cdn4.thedogapi.com/optimized/bLkWhvuqNJ.jpg,Male: 21-23.5; Female: 19-21,Male: 45-65; Female: 35-50,12-14,Male: 53-60; Female: 48-53,Male: 20-29; Female: 16-23,Samoyed,Siberia,,2,"Friendly, gentle, adaptable, alert, intelligent, playful"
,Non-Sporting,BE,BE,"Small, compact, tailless spitz-type dog with a distinctive fox-like face, thick double coat, and abundant ruff around the neck. Known as the 'little captain', this agile black dog has a confident demeanor and alert expression.",Developed in the Flemish regions of Belgium as a canal barge watchdog and ratter. The name means 'little captain' and the breed served as an adept guardian and vermin hunter on Belgian waterways for centuries.,216,https://cdn4.thedogapi.com/optimized/fWSbovpqXi.jpg,10-13,10-16,12-14,25-33,4.5-7,Schipperke,Belgium,,2,"Alert, confident, energetic, intelligent, independent, curious"
,Hound,GB,GB,"Large, athletic sighthound with rough, wiry coat and dignified bearing, often called the 'Royal Dog of Scotland', bred for coursing giant red deer in the Scottish Highlands","Ancient sighthound breed developed in Scottish Highlands to hunt giant wild red deer. Once so prized that ownership was restricted to nobility, nearly went extinct with decline of clan system but was revived in 19th century. Recognized by AKC in 1886.",218,https://cdn4.thedogapi.com/optimized/i9G4f21V3R.jpg,Male: 30-32; Female: 28-30,Male: 85-110; Female: 75-95,8-11,Male: 76-81; Female: 71-76,Male: 39-50; Female: 34-43,Scottish Deerhound,Scotland,,2,"Gentle, dignified, calm, loyal, friendly"
,Terrier,GB,GB,"Small, compact, and sturdy terrier with a distinctive wiry coat, erect ears, beard and eyebrows, and dignified, confident presence","One of Scotland's oldest Highland terrier breeds, developed in the Scottish Highlands for hunting vermin in difficult terrain. Recognized by The Kennel Club (UK) in 1883 and the AKC in 1885.",219,https://cdn4.thedogapi.com/optimized/KHqTyrsJV6.jpg,10-11,Male: 19-22; Female: 18-21,12-15,25-28,Male: 8.5-10; Female: 8-9.5,Scottish Terrier,Scotland,,2,"Confident, independent, alert, intelligent, loyal"
,Herding,GB,GB,"Small, agile herding dog from the Shetland Islands, resembling a miniature Rough Collie with a dense double coat, intelligent expression, and alert demeanor. A distinct breed known for its bright, playful nature and collie-like appearance.","Developed in the rugged Shetland Islands of Scotland as a small, hardy herding dog for sheep and ponies in harsh conditions. Created by crossing native dogs with Border Collies, Scotch Collies and possibly Spitz breeds. Recognized by AKC in 1911.",221,https://cdn4.thedogapi.com/optimized/sed3BFUfdo.jpg,13-16,15-25,12-14,33-41,7-11,Shetland Sheepdog,"Shetland Islands, Scotland",,2,"Intelligent, loyal, alert, playful, gentle, eager to please"
,Non-Sporting,JP,JP,"An ancient Japanese spitz breed with a small, compact, well-muscled frame and distinctive fox-like appearance. Known for its spirited personality, confident bearing, and agile movement.","One of Japan's six oldest native breeds, originally developed for hunting small game in mountainous terrain. Nearly extinct after WWII but saved through dedicated breeding programs. First brought to the United States in 1954.",222,https://cdn4.thedogapi.com/optimized/tLV9uXVpog.jpg,Male: 14.5-16.5; Female: 13.5-15.5,Male: 18-24; Female: 15-20,,Male: 37-42; Female: 34-39,Male: 8-11; Female: 7-9,Shiba Inu,Japan,,2,"Alert, confident, intelligent, independent, loyal, courageous"
,Toy,CN,CN,"Small, sturdy toy breed with a distinctive short snout, large dark eyes, and luxurious long flowing double coat. Known for their charming, affectionate companion temperament","Ancient breed developed in Tibetan monasteries and refined by imperial breeders in Chinese palace courts. Believed to descend from Tibetan breeds, possibly crosses between Lhasa Apso and Pekingese, prized as house pets for centuries",223,https://cdn4.thedogapi.com/optimized/FpTUahuFwc.jpg,9-10.5,9-16,10-18,23-27,4-7,Shih Tzu,Tibet/China,,2,"Affectionate, playful, outgoing, loyal"
,Herding,US,US,"Large, well-balanced shepherd breed developed from German Shepherds with a plush double coat, bred specifically for a calmer, gentler temperament and improved health compared to traditional German Shepherds","Developed in the 1970s in New York by Tina Barber, who crossed larger old-style German Shepherds with Alaskan Malamutes and other breeds to create a larger, calmer shepherd with focus on sound hips, stable temperament, reduced hip dysplasia, and family companionship",225,https://cdn4.thedogapi.com/optimized/ls767UKreG.jpg,Male: 28-30; Female: 26-28,Male: 100-130; Female: 80-100,9-14,Male: 71-76; Female: 66-71,Male: 45-59; Female: 36-45,Shiloh Shepherd,"New York, United States",,2,"Calm, gentle, intelligent, loyal, confident, affectionate"
