bred_for,breed_group,country_code,country_codes,description,history,id,image_url,imperial_height,imperial_weight,life_span,metric_height,metric_weight,name,origin,perfect_for,species_id,temperament
,Working,CH,CH,"Large, strong, and sturdy working dog with a distinctive long tricolored coat and calm, gentle temperament. One of four types of Swiss Mountain Dogs, known for being good-natured, loyal, and an excellent family companion.","One of four types of Swiss Mountain Dogs originating in the canton of Bern. Served as all-purpose farm dogs for droving cattle, pulling carts to market, and watchdogs. Nearly extinct by early 1900s but revived through careful breeding programs",41,https://cdn4.thedogapi.com/optimized/givys4YtVB.jpg,Male: 25-27.5; Female: 23-26,Male: 80-115; Female: 70-95,7-10,Male: 64-70; Female: 58-66,Male: 36-52; Female: 32-43,Bernese Mountain Dog,Switzerland,,2,"Calm, gentle, loyal, intelligent, affectionate, good-natured"
,Non-Sporting,FR,FR,"A small, sturdy, and cheerful companion dog with a soft, curly white double coat, black eyes, and a lively, playful disposition","Descended from the Barbet, a Mediterranean water spaniel. The breed was developed in France and became a popular companion dog for European nobility. The modern breed standard was established in France after World War I.",42,https://storage.googleapis.com/dog-api-uploads-prod/originals/35738179-7493-4377-b52e-3b8387e1a532.jpeg,9.5-11.5,12-18,,24-29,5-8,Bichon Frisé,France / Belgium,,2,"Happy, playful, affectionate, intelligent, gentle, energetic"
,Hound,US,US,"Large, powerful American-bred scent hound with distinctive black and tan coat pattern and long ears, known for its cold nose, loud bawling bark, and determined trailing ability","Developed in the American South by frontiersmen in the 18th century, descending from English Foxhound, Bloodhound, and Talbot Hound crosses for raccoon hunting and tracking over rugged Appalachian terrain",43,https://storage.googleapis.com/dog-api-uploads-prod/originals/67602199-27c1-4ccb-8b7b-fc724809c63b.jpeg,Male: 25-27; Female: 23-25,65-110,10-12,Male: 64-69; Female: 58-64,29-50,Black and Tan Coonhound,United States,,2,"Friendly, outgoing, intelligent, alert, adaptable, easygoing"
,Hound,BE,BE,"Large, substantial scent hound with a noble, dignified expression, characterized by exceptional tracking ability, distinctive wrinkled face, long drooping ears, loose skin, and pendulous jowls. Renowned for its extraordinary sense of smell and unparalleled tracking abilities.","Ancient breed developed by monks at the Abbey of Saint-Hubert in Belgium and France during medieval times. Later refined in England and valued for centuries for tracking game and people, eventually imported to the US for search and rescue work.",45,https://storage.googleapis.com/dog-api-uploads-prod/originals/2f5d5e94-a9ae-4d58-a781-ed685181997a.jpeg,Male: 25-27; Female: 23-25,Male: 90-110; Female: 80-100,10-12,Male: 64-69; Female: 58-64,Male: 41-50; Female: 36-45,Bloodhound,Belgium,,2,"Gentle, friendly, independent, alert, devoted, affectionate"
,Hound,US,US,"Large, athletic, and muscular scenthound with distinctive blue-ticked coat pattern and renowned 'cold nose' trailing ability, bred specifically for tracking and treeing raccoons","Developed in Louisiana from French Grand Bleu de Gascogne hounds crossed with English Foxhounds, American Foxhounds, and other local coonhound breeds, perfected for raccoon hunting in American terrain",47,https://cdn4.thedogapi.com/optimized/ajTVVTrLne.jpg,Male: 22-27; Female: 21-25,Male: 55-80; Female: 45-65,11-12,Male: 56-69; Female: 53-64,Male: 25-36; Female: 20-29,Bluetick Coonhound,United States,,2,"Friendly, intelligent, loyal, devoted, work-focused"
,Working,ZA,ZA,"Large, powerful mastiff-type guardian breed from South Africa with a muscular build, short dense coat, and confident temperament. Known as a family guardian, the name 'Boerboel' translates to 'farmer's dog' in Afrikaans.",Developed by Dutch and other European settlers in South Africa starting in the 1600s from European mastiff breeds and native dogs. Bred as all-purpose farm dogs for protecting homesteads from predators.,48,https://cdn4.thedogapi.com/optimized/RIFlrU0fUA.jpg,Male: 24-27; Female: 22-25,Male: 150-200; Female: 110-150,9-11,Male: 61-69; Female: 56-64,Male: 68-91; Female: 50-68,Boerboel,South Africa,,2,"Confident, intelligent, loyal, protective, calm"
,Herding,GB,GB,"Medium-sized, highly intelligent, and athletic herding dog with keen expression and intense work drive, renowned for its instinctual ability to control livestock with its signature stare","Developed by shepherds on the border of England and Scotland for herding sheep in hilly terrain, refined through selective breeding for working ability. The breed's lineage can be traced back to a single dog named Old Hemp, born in 1893.",50,https://storage.googleapis.com/dog-api-uploads-prod/originals/7ac26a12-d3bd-4939-a417-cf77f414fb0d.jpeg,Male: 19-22; Female: 18-21,30-55,12-15,Male: 48-56; Female: 46-53,14-25,Border Collie,Anglo-Scottish border region,,2,"Intelligent, energetic, alert, work-focused, loyal, eager to please"
,Terrier,GB,GB,"Small, sturdy working terrier with weather-resistant wiry coat and distinctive otter-like head, bred for fox hunting with a plucky and affectionate nature",Developed in the 18th century in the Cheviot Hills along the English-Scottish border by farmers and shepherds to hunt fox alongside foxhounds. Needed to be small enough to follow quarry into dens and burrows but tough enough to keep up with horses and work independently.,51,https://storage.googleapis.com/dog-api-uploads-prod/originals/6fcf6ce9-b2df-45c0-b154-1317df7b6c2c.jpeg,Male: 13-16; Female: 11-14,Male: 13-15.5; Female: 11.5-14,12-15,Male: 33-41; Female: 28-36,Male: 6-7; Female: 5-6.5,Border Terrier,Border regions between England and Scotland,,2,"Affectionate, intelligent, alert, energetic, courageous, adaptable"
,Non-Sporting,US,US,"Compact, short-tailed dog with distinctive flat face, erect ears, and smooth 'tuxedo' coat markings. Known as 'The American Gentleman' for its friendly and intelligent demeanor.",Developed in Boston in the 1870s from crossing English Bulldog with the now-extinct White English Terrier. Refined in the late 19th century and became one of the first American-developed breeds recognized by the AKC.,53,https://cdn4.thedogapi.com/optimized/0JqHiVXBhZ.jpg,15-17,12-25,11-13,38-43,5-11,Boston Terrier,"Boston, Massachusetts, United States",,2,"Friendly, intelligent, outgoing, playful"
,Herding,BE,BE,"Large, powerfully built herding dog with a rugged appearance and rough, tousled double coat. This compact breed gives the impression of great strength without heaviness and has a dense weather-resistant coat suited for farm work.","Developed by monks in the Flanders region of medieval Europe as cattle herding and all-purpose farm dog. Used to drive cattle, pull carts, and serve as a watchdog. Nearly extinct after World War I but revived by dedicated breeders.",54,https://storage.googleapis.com/dog-api-uploads-prod/originals/be25309f-6190-40c9-b5b5-02630f873592.png,Male: 24.5-27.5; Female: 23.5-26.5,70-110,10-12,Male: 62-70; Female: 60-67,32-50,Bouvier des Flandres,Belgium (Flanders region),,2,"Loyal, intelligent, protective, courageous, calm, gentle"
,Working,DE,DE,"Medium to large, powerful and athletic working dog with a distinctive short-muzzled, flat face and short coat. Known for their fun-loving, bright temperament and expressive face, combining energy with loyalty.","Developed in late 19th century Germany from the now-extinct German Bullenbeisser (used for hunting large game like boar and bear) and English Bulldog, originally for bull-baiting and hunting, later refined for working and companion roles",55,https://cdn4.thedogapi.com/optimized/uFPUHEvbID.jpg,Male: 23-25; Female: 21.5-23.5,Male: 65-80; Female: 50-65,10-12,Male: 58-64; Female: 55-60,Male: 29-36; Female: 23-29,Boxer,Germany,,2,"Playful, energetic, loyal, intelligent, friendly, alert"
,Sporting,US,US,"Medium-sized, energetic, and versatile flushing and retrieving spaniel with rich liver or chocolate brown coat and enthusiastic work ethic, especially in water. Known for their amiable disposition and compact build ideal for hunting from small boats.","Developed in early 1900s in South Carolina by L. Whitaker Boykin. Foundation sire was a small stray spaniel-type dog named 'Dumpy' who showed great hunting aptitude. Bred by crossing Chesapeake Bay Retrievers, Springer Spaniels, Cocker Spaniels, and American Water Spaniels for hunting in South Carolina swamps, particularly the Wateree River Swamp. Recognized as the state dog of South Carolina.",56,https://cdn4.thedogapi.com/optimized/i3VwMxfPgP.jpg,Male: 15.5-18; Female: 14-16.5,Male: 30-40; Female: 25-35,10-15,Male: 39-46; Female: 36-42,Male: 14-18; Female: 11-16,Boykin Spaniel,"South Carolina, United States",,2,"Friendly, energetic, eager to please, intelligent, adaptable"
,Sporting,IT,IT,"Large, noble Italian pointing breed with sculpted head, distinctive orange and white or chestnut and white coat, and pendulous ears. A powerful and athletic dog of ancient Italian lineage, known for its endurance and gentle, intelligent nature.","One of the oldest pointing breeds in Europe with ancient origins dating back to the 4th-5th century BC. Developed as a versatile hunting dog for bird hunting in Italian terrain, adept at pointing and retrieving. The modern breed is thought to be a cross of the Piedmontese Pointer and the Lombard Pointer.",57,https://cdn4.thedogapi.com/optimized/Sewp0Ubej3.jpg,Male: 23-26; Female: 21.5-24.5,55-88,10-14,Male: 58-67; Female: 55-62,25-40,Bracco Italiano,Italy,,2,"Gentle, intelligent, affectionate, loyal, calm, docile, adaptable"
,Herding,FR,FR,"Large, powerful French herding dog with a luxurious long wavy double coat, distinctive beard and eyebrows creating a peek-a-boo hairdo, and a loyal, intelligent disposition","Ancient French herding breed developed for centuries to herd and guard flocks. Served as sentries, messengers, and pack animals for the French army during World War I. Nearly extinct after World War II but successfully revived. Recognized by the AKC in 1928.",58,https://cdn4.thedogapi.com/optimized/QHeak9hrOm.jpg,Male: 23-27; Female: 22-25.5,Male: 70-100; Female: 50-65,10-12,Male: 58-69; Female: 56-65,Male: 32-45; Female: 23-29,Briard,France,,2,"Loyal, intelligent, protective, confident, courageous, devoted"
,Sporting,FR,FR,"Medium-sized, compact and leggy sporting dog with an athletic build and distinctive orange and white feathered coat. Known for its versatility in pointing and retrieving, this agile gundog combines high energy for hunting and field work with an intelligent and happy-go-lucky disposition.",Developed in the 17th-18th century in the Brittany province of France as a versatile hunting dog capable of pointing and retrieving on various terrain. Refined through crosses with English Setters and recognized by AKC in 1934.,59,https://storage.googleapis.com/dog-api-uploads-prod/originals/7d55f697-6879-4616-af9d-668aa3226289.jpeg,17.5-20.5,30-40,12-15,44-52,14-18,Brittany,"Brittany (Bretagne), France",,2,"Intelligent, energetic, eager to please, friendly, athletic, happy"
,Working,GB,GB,"Large, powerful guardian breed with short coat and calm, confident demeanor, originally bred to guard estates and known as 'The Gamekeeper's Night-Dog'",Developed in mid-19th century England by gamekeepers crossing English Mastiff with Old English Bulldog to create an effective estate guard dog for tracking poachers,64,https://cdn4.thedogapi.com/optimized/QdwFluBnbf.jpg,Male: 25-27; Female: 24-26,Male: 110-130; Female: 100-120,7-9,Male: 64-69; Female: 61-66,Male: 50-59; Female: 45-54,Bullmastiff,England,,2,"Loyal, protective, calm, courageous, affectionate, confident"
,Terrier,GB,GB,"A muscular, well-built terrier best known for its distinctive long, egg-shaped head that slopes down to the nose. This confident breed combines a playful, mischievous personality with a courageous temperament.","Developed in 19th-century England by crossing old English Bulldogs with various terriers, originally for bull-baiting and dog fighting. James Hinks is credited with standardizing the breed and creating the distinctive egg-shaped head, earning them the nickname 'The White Cavalier'.",61,https://storage.googleapis.com/dog-api-uploads-prod/originals/19be57ef-e967-4330-81f3-83a7c1ac809c.jpeg,21-22,50-70,12-13,53-56,23-32,Bull Terrier,England,,2,"Playful, courageous, energetic, loyal, mischievous"
,Terrier,GB,GB,"Small, upstanding, and muscular terrier with a distinctive egg-shaped head and triangular eyes. This compact version of the Bull Terrier is known for being comical, mischievous, and lively with a squarely built frame.","Developed in 19th-century England as a scaled-down version of the standard Bull Terrier, which was standardized by James Hinks. Created for fanciers who wanted a smaller companion version while maintaining the same characteristics and recognized as a separate breed by the AKC in 1991.",62,https://storage.googleapis.com/dog-api-uploads-prod/originals/bac74252-a536-4cd7-bf5f-2db7a7690c97.jpeg,10-14,20-33,11-13,25-36,9-15,Bull Terrier (Miniature),England,,2,"Playful, energetic, courageous, confident, affectionate, outgoing"
,Terrier,GB,GB,"A small, sturdy working terrier with weather-resistant shaggy coat and alert expression, originating from the Scottish Highlands and known for its plucky, cheerful nature","Developed on the Isle of Skye in Scotland, one of the oldest terrier breeds. Originally used by farmers in the Scottish Highlands to hunt and flush out foxes and vermin from rock piles (cairns), which gave the breed its name. Recognized by the AKC in 1913.",65,https://cdn4.thedogapi.com/optimized/AEtWWjCcLL.jpg,Male: 10-11; Female: 9.5-10.5,Male: 14-16; Female: 13-15,,Male: 25-28; Female: 24-27,Male: 6-7.5; Female: 6-7,Cairn Terrier,Scotland,,2,"Alert, confident, friendly, intelligent, courageous, energetic"
,Working,IT,IT,"Large, powerful Italian mastiff-type dog with muscular, athletic build and confident demeanor. This intelligent and majestic breed was historically used as a guardian and hunter, known for its loyalty to family.","Ancient Italian breed descended from Roman Molossian war dogs, developed as a versatile farmhand, guardian, and hunter of large game. The breed nearly faced extinction but was revived by enthusiasts in the 1970s.",67,https://storage.googleapis.com/dog-api-uploads-prod/originals/10d8fcaf-a0dd-4988-9e69-54002e3c4f83.png,Male: 25-27.5; Female: 23.5-26,Male: 99-110; Female: 88-99,9-12,Male: 64-70; Female: 60-66,Male: 45-50; Female: 40-45,Cane Corso,Italy,,2,"Confident, protective, intelligent, loyal, affectionate"
,Herding,GB,GB,"Low-set, sturdily built herding dog with a long body, fox-like brushy tail, and rounded ears, known for intelligence and versatility","One of the oldest herding breeds, believed brought to Wales by Celtic tribes around 1200 BC, developed as versatile farm dogs for cattle herding and property guarding",68,https://storage.googleapis.com/dog-api-uploads-prod/originals/3c664674-c538-4c15-bab4-6ae3096dbcfb.png,10.5-12.5,Male: 30-38; Female: 25-34,12-15,27-32,Male: 14-17; Female: 11-15,Cardigan Welsh Corgi,"Cardiganshire, Wales",,2,"Affectionate, loyal, intelligent, alert, adaptable"
,Herding,US,US,"Medium to large, athletic herding and hunting breed known for its distinctive spotted or merle coat patterns, striking heterochromatic (glass) eyes, and strong work ethic. This versatile working dog combines intelligence with independence.",Developed in Northern Louisiana from Native American dogs crossed with Spanish and French settlers' dogs for hunting feral hogs and herding cattle. Named after Catahoula Parish and designated as the official state dog of Louisiana.,69,https://cdn4.thedogapi.com/optimized/Q1BZEKatoN.jpg,Male: 22-26; Female: 20-24,Male: 65-90; Female: 50-65,10-14,Male: 56-66; Female: 51-61,Male: 29-41; Female: 23-29,Catahoula Leopard Dog,"Louisiana, United States",,2,"Independent, intelligent, loyal, protective, energetic, work-focused"
,Working,RU,RU,"Massive, powerful livestock guardian breed with thick, weather-resistant double coat, originally bred to protect flocks from large predators like wolves and bears in the Caucasus Mountains. This formidable guardian combines strong protective instincts with courageous temperament.","Ancient breed developed in the Caucasus Mountain region to protect flocks from large predators like wolves and bears, as well as human thieves. Selectively bred by shepherds for protection ability, later utilized by the Soviet Union as military and prison guard dogs",70,https://cdn4.thedogapi.com/optimized/N9DEB8FyHi.jpg,Male: 27-30; Female: 25-28,Male: 110-170; Female: 99-150,10-12,Male: 68-76; Female: 64-71,Male: 50-77; Female: 45-68,Caucasian Shepherd Dog,Caucasus Mountains,,2,"Protective, independent, confident, courageous, alert"
,Toy,GB,GB,"Small, elegant toy spaniel with silky coat, large expressive eyes, and noble appearance, known for its gentle expression and affectionate temperament, equally at home as a lap dog or active companion","Named after King Charles II who favored the breed, descended from toy spaniels depicted in 16th-18th century British court paintings. The modern breed was revived in the 1920s by enthusiasts seeking to restore the longer-nosed type seen in old portraits",71,https://cdn4.thedogapi.com/optimized/fM3yF6cLB1.jpg,12-13,13-18,12-15,30-33,6-8,Cavalier King Charles Spaniel,United Kingdom,,2,"Affectionate, gentle, friendly, playful, eager to please, adaptable"
,Sporting,US,US,"A powerful, muscular gundog with distinctive wavy, waterproof double coat and amber eyes, bred for retrieving waterfowl in the harsh conditions of the Chesapeake Bay",Developed in the 19th century along the Chesapeake Bay from two shipwrecked Newfoundland-type puppies (Sailor and Canton) bred with local retrievers to create a water gundog capable of withstanding icy conditions and retrieving waterfowl in harsh environments,76,https://cdn4.thedogapi.com/optimized/MLiMZc2OS4.jpg,Male: 23-26; Female: 21-24,Male: 65-80; Female: 55-70,10-13,Male: 58-66; Female: 53-61,Male: 29-36; Female: 25-32,Chesapeake Bay Retriever,"Maryland, United States",,2,"Intelligent, courageous, loyal, protective, confident"
,Toy,CN,CN,"Small, elegant toy dog with fine-boned build that comes in two distinctive varieties: the Hairless with soft skin and tufts of hair, and the Powderpuff with a soft, straight double coat",Ancient breed believed to have descended from African or Mexican hairless dogs and refined in China. Chinese mariners kept them on ships to hunt vermin and traded them among port cities worldwide. Served as companions to Chinese nobility and were believed to possess magical healing powers,78,https://cdn4.thedogapi.com/optimized/EmZBU7gxxa.jpg,11-13,8-12,,28-33,3.6-5.4,Chinese Crested,China,,2,"Affectionate, alert, playful, lively, intelligent, gentle"
,Non-Sporting,CN,CN,"An ancient Chinese breed known for its distinctive deep wrinkles, hippopotamus-like muzzle, blue-black tongue, and compact, medium-sized build with a calm, independent temperament","Ancient Chinese breed from southern provinces dating back to the Han Dynasty, originally used as all-purpose farm dog for hunting, herding, guarding, and farm work. Nearly extinct in mid-20th century but revived from very small population by dedicated breeders in 1970s",79,https://cdn4.thedogapi.com/optimized/Rrs2lVEQHq.jpg,18-20,45-60,8-12,46-51,20-27,Chinese Shar-Pei,China,,2,"Loyal, independent, calm, alert, protective, intelligent"
,Working,US,US,"Large, athletic American sled dog with distinctive tawny double coat, known for combining strength, endurance, and a calm, gentle temperament. This versatile working breed was developed for drafting and sled-dog racing in New England conditions.","Developed in the early 20th century by polar explorer Arthur Treadwell Walden by crossing Mastiff-type dogs with Huskies and Belgian Shepherds. Named after the foundation male 'Chinook', bred to be an ideal sled dog for New England conditions. Recognized by the AKC in 2013.",80,https://cdn4.thedogapi.com/optimized/LtHPr7ay0L.jpg,Male: 23-26; Female: 21-25,Male: 55-90; Female: 50-70,12-15,Male: 58-66; Female: 53-64,Male: 25-41; Female: 23-32,Chinook,"New Hampshire, United States",,2,"Intelligent, calm, devoted, friendly, eager to please"
,Non-Sporting,CN,CN,"An ancient, powerful, and sturdily built dog of Arctic spitz-type, known for its distinctive lion-like mane, unique blue-black tongue, stilted gait, and dense double coat","One of the oldest recognizable breeds with origins dating back over 2,000 years in northern China, where it served as hunting, herding, guarding, and companion dog. Refined during Tang Dynasty and recognized by AKC in 1903.",81,https://cdn4.thedogapi.com/optimized/XSu9Ht84DA.jpg,17-20,45-70,8-12,43-51,20-32,Chow Chow,China,,2,"Loyal, independent, aloof, alert, calm, protective"
,Sporting,GB,GB,"A long, low, and substantial flushing spaniel with a massive head, heavy bone structure, pensive expression, and predominantly white coat with lemon or orange markings","Developed in the 18th century, associated with the French Duc de Noailles and Duke of Newcastle's Clumber Park estate in Nottinghamshire. Likely developed from Alpine Spaniel, Basset Hound crosses. Prized by British royalty and nobility as gentleman's hunting spaniels for game flushing",84,https://cdn4.thedogapi.com/optimized/M5cp3u9VBx.jpg,Male: 17-20; Female: 17-19,Male: 70-85; Female: 55-70,10-12,Male: 43-51; Female: 43-48,Male: 32-39; Female: 25-32,Clumber Spaniel,England,,2,"Gentle, loyal, calm, intelligent, playful"
,Sporting,US,US,"Compact sporting breed with silky coat, merry expression, and affectionate nature","Descended from English Cocker Spaniels, developed in the US for smaller size and specialized for woodcock hunting; officially recognized as a distinct breed by the AKC in 1946",86,https://cdn4.thedogapi.com/optimized/OIR28n2ihA.jpg,Male: 13.5-15.5; Female: 12.5-14.5,Male: 25-30; Female: 20-25,10-14,Male: 34-39; Female: 32-37,Male: 11-14; Female: 9-11,Cocker Spaniel,United States,,2,"Friendly, affectionate, playful, intelligent, outgoing"
,Non-Sporting,MG,MG,"Small companion dog with soft cotton-like white coat, charming personality and cheerful temperament","Originated as royal dog and companion to nobles in Madagascar, developed from small white dogs brought by traders. Named for city of Tuléar and recognized by FCI and AKC as beloved adaptable companion breed",89,https://cdn4.thedogapi.com/optimized/mFiuFIyvhH.jpg,Male: 10-11; Female: 9-10,Male: 9-15; Female: 8-13,,Male: 25-28; Female: 23-25,Male: 4-7; Female: 3.5-6,Coton de Tulear,Madagascar,,2,"Happy, playful, affectionate, alert, friendly, intelligent, adaptable"
,Non-Sporting,HR,HR,"Medium-sized, athletic dog with distinctive black or liver spotted white coat and elegant build, originally bred as a carriage dog with exceptional endurance","Ancient breed with roots in Dalmatia, Croatia, originally bred as carriage dogs to run for miles alongside horse-drawn coaches, guarding horses and coaches. Also served as circus performers and iconic firehouse mascots, particularly associated with American fire departments. Recognized by AKC in 1888.",92,https://cdn4.thedogapi.com/optimized/ACDtQWVRBr.jpg,Male: 23-24; Female: 22-23,Male: 55-70; Female: 45-60,11-13,Male: 58-61; Female: 56-58,Male: 25-32; Female: 20-27,Dalmatian,"Dalmatia, Croatia",,2,"Energetic, outgoing, intelligent, alert, athletic"
,Working,DE,DE,"Medium-large, sleek, athletic and powerful dog known for exceptional loyalty and intelligence. This elegant working breed combines strength with agility and has a confident, alert demeanor.","Created in late 19th century by Karl Friedrich Louis Dobermann using breeds such as the Rottweiler, German Pinscher, and others for protection and companionship",94,https://cdn4.thedogapi.com/optimized/yy1nVxX1TD.jpg,Male: 26-28; Female: 24-26,Male: 75-100; Female: 60-90,10-12,Male: 66-71; Female: 61-66,Male: 34-45; Female: 27-41,Doberman Pinscher,Germany,,2,"Intelligent, alert, loyal, energetic, confident"
,Working,AR,AR,"Large, powerful, all-white mastiff-type dog with massive head and athletic build, originally developed for big-game hunting with exceptional courage and strength","Developed in Argentina in the 1920s by Dr. Antonio Nores Martinez who systematically crossed the now-extinct Cordoba Fighting Dog with Great Dane, Boxer, Bull Terrier, and Pointer to create a versatile big-game hunter for wild boar and puma",95,https://cdn4.thedogapi.com/optimized/TKneriCOWC.jpg,Male: 24-26.5; Female: 24-25.5,Male: 88-100; Female: 88-95,9-15,Male: 61-67; Female: 61-65,Male: 40-45; Female: 40-43,Dogo Argentino,Argentina,,2,"Courageous, loyal, protective, confident, intelligent, energetic"
,Herding,NL,NL,"Medium-sized herding dog with athletic, muscular build and distinctive brindle coat pattern. An intelligent, versatile, and work-focused breed of Dutch origin that served as an all-purpose farm dog.","Developed in the Netherlands as an all-purpose farm dog for herding sheep and cattle, cart-pulling, and guarding. Nearly extinct after WWII but preserved through dedicated breeding efforts. Known for its brindle coat in three varieties: short, long, and wire-haired.",98,https://cdn4.thedogapi.com/optimized/GxmoWNpZqN.jpg,Male: 22.5-25; Female: 21.5-24,Male: 50-75; Female: 42-65,11-14,Male: 57-64; Female: 55-61,Male: 23-34; Female: 19-30,Dutch Shepherd,Netherlands,,2,"Intelligent, loyal, alert, energetic, athletic, work-focused, independent"
